,title,author,num_reviews,num_ratings,avg_rating,num_pages,publish_year,first_published,series,genres,awards,places,url
0,The Name of the Wind,Patrick Rothfuss,45737,798127,4.51,662,2007,2007,1,"Fantasy,Fiction,Fantasy > Epic Fantasy","Locus Award Nominee for Best First Novel and Best Fantasy Novel (2008), Compton Crook Award Nominee (2008), Grand Prix de l'Imaginaire Nominee for Roman étranger and Traduction (2010), ALA Alex Award (2008), The Quill Award for Science Fiction/Fantasy/Horror (2007)
Sakura Medal for High School Book (2009), Premio Ignotus Nominee for Mejor novela extranjera (Best Foreign Novel) (2010), Tähtifantasia Award Nominee (2011) ",,https://www.goodreads.com/book/show/186074.The_Name_of_the_Wind
1,Eragon,Christopher Paolini,23561,1549734,3.92,503,2005,2002,1,"Fantasy,Young Adult,Fiction",,,https://www.goodreads.com/book/show/113436.Eragon
2,The Lies of Locke Lamora,Scott Lynch,16560,257431,4.25,752,2006,2006,1,"Fantasy,Fiction,Adventure","Locus Award Nominee for Best Fantasy Novel and Best First Novel (2007), World Fantasy Award Nominee for Best Novel (2007), Compton Crook Award Nominee (2007), Grand Prix de l'Imaginaire Nominee for Roman étranger (2008), Tähtifantasia Award Nominee (2008)
British Fantasy Award Nominee for Best Novel (2007) ",Camorr,https://www.goodreads.com/book/show/29588376-the-lies-of-locke-lamora
3,Graceling,Kristin Cashore,23718,426183,4.06,471,2008,,1,"Fantasy,Young Adult,Romance","Locus Award Nominee for Best First Novel (2009), Mythopoeic Fantasy Award for Children's Literature (2009), William C. Morris YA Debut Award Nominee (2009), Rhode Island Teen Book Award (2011), Milwaukee County Teen Book Award Nominee (2010)
Sakura Medal Nominee for High School Book (2010), Florida Teens Read Nominee (2010), Amelia Elizabeth Walden Award Nominee (2009), Iowa High School Book Award Nominee (2011), California Young Readers Medal for Young Adult (2012), Lincoln Award Nominee (2011), Andre Norton Award Nominee (2008), CYBILS Award Nominee for Young Adult Fantasy & Science Fiction (2008), Green Mountain Book Award (2011), Missouri Gateway Readers Award Nominee (2011), LovelyBooks Leserpreis Nominee for Allgemeine Literatur (2009) ",,https://www.goodreads.com/book/show/3236307-graceling
4,A Storm of Swords,George R.R. Martin,22842,702463,4.53,1177,2003,2000,1,"Fantasy,Fiction,Fantasy > Epic Fantasy","Hugo Award Nominee for Best Novel (2001), Nebula Award Nominee for Best Novel (2001), Locus Award for Best Fantasy Novel (2001), Geffen Award for Best Translated Fantasy Book (2002), Premio Ignotus (2006)
Premi Ictineu for Millor novel·la traduïda (2013) ","Westeros,Essos",https://www.goodreads.com/book/show/62291.A_Storm_of_Swords
5,Across the Nightingale Floor,Lian Hearn,2255,37574,4.06,305,2002,,1,"Fantasy,Fiction,Historical > Historical Fiction","Wirral Paperback of the Year (2004), Peter Pan Award, Deutscher Jugendliteraturpreis for Preis der Jugendjury (2004), Lincoln Award Nominee (2007), Carnegie Medal Nominee (2002)
La Nuit du Livre for Littérature (2003) ",,https://www.goodreads.com/book/show/77160.Across_the_Nightingale_Floor
6,The Hundred Thousand Kingdoms,N.K. Jemisin,6361,65692,3.86,427,2010,,1,"Fantasy,Fiction,Romance","Hugo Award Nominee for Best Novel (2011), Nebula Award Nominee for Best Novel (2010), Locus Award for Best First Novel (2011), World Fantasy Award Nominee for Best Novel (2011), James Tiptree Jr. Award Nominee (2010)
David Gemmell Morningstar Award Nominee for Best Fantasy Newcomer (2011), David Gemmell Ravenheart Award Nominee for Best Fantasy Cover Art (2011), Goodreads Choice Award Nominee for Fantasy (2010), Prix Elbakin.net for Meilleur roman fantasy traduit (2011) ",,https://www.goodreads.com/book/show/6437061-the-hundred-thousand-kingdoms
7,Daughter of Smoke & Bone,Laini Taylor,30982,350151,3.98,418,2011,,1,"Fantasy,Young Adult,Romance","Locus Award Nominee for Best Young Adult Novel (2012), Audie Award for Fantasy (2012), Rhode Island Teen Book Award Nominee (2013), Milwaukee County Teen Book Award Nominee (2013), Children's Choice Book Award Nominee for Teen Choice Book of the Year (2012)
The Inky Awards Nominee for Silver Inky (2012), California Young Readers Medal Nominee for Young Adult (2015), Oregon Spirit Book Award for Young Adult (2011), Lincoln Award Nominee (2014), Andre Norton Award Nominee (2011), Goodreads Choice Award Nominee for Young Adult Fantasy & Science Fiction and for Favorite Book (2011), The Inky Awards Shortlist for Silver Inky (2012), Missouri Gateway Readers Award Nominee (2014), Premio El Templo de las Mil Puertas Nominee for Mejor novela extranjera perteneciente a saga (2012) ","Prague (Praha),Marrakech (Marrakesh),Eretz",https://www.goodreads.com/book/show/8490112-daughter-of-smoke-bone
8,American Gods,Neil Gaiman,41053,822694,4.1,635,2011,2001,1,"Fantasy,Fiction,Fantasy > Urban Fantasy","Bram Stoker Award for Best Novel (2001), Hugo Award for Best Novel (2002), Nebula Award for Best Novel (2002), Locus Award for Best Fantasy Novel (2002), International Horror Guild Award Nominee for Best Novel (2001)
World Fantasy Award Nominee for Best Novel (2002), SFX Award for Best Novel (2002), Geffen Award (2003), Mythopoeic Fantasy Award Nominee for Adult Literature (2002), British Science Fiction Association Award Nominee for Best Novel (2001), Grand Prix de l'Imaginaire Nominee for Roman étranger (2003), Prix Bob Morane for roman traduit (2003), British Fantasy Award Nominee for Best Novel (August Derlith Fantasy Award) (2002) ","The United States of America,Chicago, Illinois,Chattanooga, Tennessee,,,",https://www.goodreads.com/book/show/30165203-american-gods
9,The Fifth Season,N.K. Jemisin,21133,194008,4.27,468,2015,,1,"Fantasy,Fiction,Science Fiction","Hugo Award for Best Novel (2016), Nebula Award Nominee for Best Novel (2015), Locus Award Nominee for Best Fantasy Novel (2016), World Fantasy Award Nominee for Best Novel (2016), Grand Prix de l'Imaginaire Nominee for Traduction (2018) (2019)
James Tiptree Jr. Award Nominee for Longlist (2015), Premio Ignotus Nominee for Mejor novela extranjera - Best Foreign Novel (2018), The Kitschies Nominee for Red Tentacle (Novel) (2015), Goodreads Choice Award Nominee for Fantasy (2015), Dragon Award Nominee for Best Fantasy Novel and Best Apocalyptic Novel (2016), Le Blanc Award Nominee for Melhor Romance Estrangeiro de Fantasia, Ficção Científica ou Terror Publicado em Língua Portuguesa (2018) ",,https://www.goodreads.com/book/show/19161852-the-fifth-season
10,The Night Circus,Erin Morgenstern,81662,781613,4.03,528,2011,,0,"Fantasy,Fiction,Romance","Locus Award for Best First Novel (2012), Orange Prize Nominee for Fiction Longlist (2012), Guardian First Book Award Nominee for Longlist (2011), Mythopoeic Fantasy Award Nominee for Adult Literature (2012), ALA Alex Award (2012)
Lincoln Award Nominee (2014), The Kitschies Nominee for Golden Tentacle (Debut) (2011), Goodreads Choice Award Nominee for Best Fantasy and for Favorite Book (2011), International Dublin Literary Award Nominee (2013) ","London, England,England,United Kingdom,,,",https://www.goodreads.com/book/show/9361589-the-night-circus
11,Finnikin of the Rock,Melina Marchetta,4523,50409,3.86,416,2008,,1,"Fantasy,Young Adult,Romance","Children's Book Council of Australia Award Nominee for Book of the Year - Older Readers (2009), Aurealis Award for Young Adult Novel (2008), Sakura Medal Nominee for High School Book (2010), Lincoln Award Nominee (2013), Australian Book Industry Award (ABIA) for Older Children (ages 8-14) (2009)
Premio El Templo de las Mil Puertas for Mejor novela extranjera perteneciente a saga (2012) ",,https://www.goodreads.com/book/show/4932435-finnikin-of-the-rock
12,Watership Down,Richard Adams,14779,454817,4.06,478,1975,1972,1,"Classics,Fiction,Fantasy","Mythopoeic Fantasy Award Nominee (1975), Guardian Children's Fiction Prize (1973), Audie Award Nominee for Best Male Narrator (2020), Boston Globe-Horn Book Award (1975), California Young Readers Medal for Young Adult (1977)
Carnegie Medal (1972) ","Watership Down, Hampshire,Hampshire, England,England,",https://www.goodreads.com/book/show/76620.Watership_Down
13,Harry Potter and the Sorcerer's Stone,J.K. Rowling,125137,7940545,4.47,309,2003,1997,1,"Fantasy,Fiction,Young Adult","Mythopoeic Fantasy Award for Children's Literature (2008), British Book Award for Children's Book of the Year (1998), Prijs van de Nederlandse Kinderjury for 6-9 jaar en 10-12 jaar (2002), American Booksellers Book Of The Year Award for Children (1999), Audie Award (2000)
West Australian Young Readers' Book Award (WAYRBA) for Younger Readers (2000), South Carolina Book Award for Junior Book Award (2001), Grand Canyon Reader Award for Teen Book (2000), Charlotte Award (2000), Nene Award (2000), Massachusetts Children's Book Award (2000), Colorado Blue Spruce Young Adult Book Award (2001), Blue Hen Book Award for Chapter Book (2001), Nevada Young Readers' Award for Young Reader Category (2000), Golden Archer Award for Middle/Junior High (2000), Indian Paintbrush Book Award (2000), Hotze de Roosprijs (2002), Nestlé Smarties Book Prize for 9–11 years (1997), Eliot Rosewater Indiana High School Book Award (2001), Kinderboekwinkelprijs (1999), Parenting Book of the Year Award (1998), North East Teenage Book Award (1999), Specsavers National Book Award for Children's Book of the Year (1998), Washington State Sasquatch Award (2000), Literaturpreis der Jury der jungen Leser for Kinderbuch (1999), Carnegie Medal Nominee (1997), Rebecca Caudill Young Readers' Book Award (2001), Premi Protagonista Jove for Categoria 12-13 anys (2000) ","London, England,Hogwarts School of Witchcraft and Wizardry,Hogwarts School of Witchcraft and Wizardry",https://www.goodreads.com/book/show/3.Harry_Potter_and_the_Sorcerer_s_Stone
14,Jonathan Strange & Mr Norrell,Susanna Clarke,15288,220809,3.82,1006,2006,2004,0,"Fantasy,Fiction,Historical > Historical Fiction","Hugo Award for Best Novel (2005), Booker Prize Nominee for Longlist (2004), Nebula Award Nominee for Best Novel (2005), Locus Award for Best First Novel and Nominee for Best Fantasy Novel (2005), Guardian First Book Award Nominee (2004)
World Fantasy Award for Best Novel (2005), Mythopoeic Fantasy Award for Adult Literature (2005), Book Sense Book of the Year Award for Adult Fiction (2005), British Fantasy Award Nominee for Best Novel (2005), Cena Akademie SFFH for Kniha roku (Book of the Year) (2007) ",United Kingdom,https://www.goodreads.com/book/show/14201.Jonathan_Strange_Mr_Norrell
15,Uprooted,Naomi Novik,24586,199375,4.04,435,2015,,0,"Fantasy,Young Adult,Fiction","Hugo Award Nominee for Best Novel (2016), Nebula Award for Best Novel (2015), Locus Award for Best Fantasy Novel (2016), World Fantasy Award Nominee for Best Novel (2016), Mythopoeic Fantasy Award for Adult Literature (2016)
British Fantasy Award for Best Fantasy Novel (the Robert Holdstock Award) (2016), Goodreads Choice Award Nominee for Young Adult Fantasy & Science Fiction (2015) ",,https://www.goodreads.com/book/show/22544764-uprooted
16,Six of Crows,Leigh Bardugo,63155,542069,4.47,465,2015,,1,"Fantasy,Young Adult,Fiction","Pennsylvania Young Readers' Choice Award Nominee for Young Adults (2017), Rhode Island Teen Book Award Nominee (2018), Evergreen Teen Book Award Nominee (2018), Milwaukee County Teen Book Award Nominee (2017), Lincoln Award (2018)
Goodreads Choice Award Nominee for Young Adult Fantasy & Science Fiction (2015), Missouri Gateway Readers Award Nominee (2017), Premio El Templo de las Mil Puertas for Mejor novela extranjera perteneciente a saga (2016), Hea Noorteraamat (2017) ",Ketterdam,https://www.goodreads.com/book/show/23437156-six-of-crows
17,Under Heaven,Guy Gavriel Kay,1627,13751,4.16,573,2010,2010,1,"Fantasy,Historical > Historical Fiction,Fiction","Locus Award Nominee for Best Fantasy Novel (2011), World Fantasy Award Nominee for Best Novel (2011), Mythopoeic Fantasy Award Nominee for Adult Literature (2011), Sunburst Award for Canadian Novel (2011), Prix Aurora Award Nominee for Best Novel (2011) and for Best of the Decade (2017)
Goodreads Choice Award Nominee for Fantasy (2010), Prix Elbakin.net for Meilleur roman fantasy traduit (2015) ",China,https://www.goodreads.com/book/show/7139892-under-heaven
18,Shadow and Bone,Leigh Bardugo,59508,598541,3.97,358,2012,,1,"Fantasy,Young Adult,Romance","South Carolina Book Award Nominee for Junior Book (2015), Pennsylvania Young Readers' Choice Award Nominee for Young Adults (2014), Rhode Island Teen Book Award Nominee (2015), Dorothy Canfield Fisher Children's Book Award Nominee (2014), Lincoln Award Nominee (2014)
Goodreads Choice Award Nominee for Young Adult Fantasy & Science Fiction (2012), Prix Elbakin.net for Meilleur roman fantasy traduit Jeunesse (2013) ",Ravka,https://www.goodreads.com/book/show/10194157-shadow-and-bone
19,Inkheart,Cornelia Funke,12696,403411,3.89,563,2005,2003,1,"Fantasy,Young Adult,Fiction","Locus Award Nominee for Best Young Adult Book (2004), Mythopoeic Fantasy Award Nominee for Children's Literature (2004), Zilveren Griffel (2006), Grand Prix de l'Imaginaire Nominee for Roman jeunesse (2004), Nene Award (2009)
Flicker Tale Children's Book Award (2006), Deutscher Jugendliteraturpreis Nominee for Preis der Jugendjury (2004), Phantastik-Preis der Stadt Wetzlar (2004), Literaturpreis der Jury der jungen Leser for Kinderbuch (2004) ",Italy,https://www.goodreads.com/book/show/28194.Inkheart
20,An Ember in the Ashes,Sabaa Tahir,27609,230177,4.25,446,2016,2015,1,"Fantasy,Young Adult,Romance","Pennsylvania Young Readers' Choice Award Nominee for Young Adults (2017), Rhode Island Teen Book Award Nominee (2017), Evergreen Teen Book Award Nominee (2018), Milwaukee County Teen Book Award Nominee (2016), Dioraphte Jongerenliteratuurprijs Nominee for Vertaald boek (2016)
Lincoln Award Nominee (2018), David Gemmell Morningstar Award Nominee for Best Fantasy Newcomer (2016), Goodreads Choice Award Nominee for Debut Goodreads Author, and for Young Adult Fantasy & Science Fiction (2015), The Magnolia Award Nominee for 9-12 (2018), Prix Elbakin.net for Meilleur roman fantasy traduit Jeunesse (2016), Missouri Gateway Readers Award Nominee (2017), Premio El Templo de las Mil Puertas Nominee for Mejor novela extranjera perteneciente a saga (2015) ",,https://www.goodreads.com/book/show/27774758-an-ember-in-the-ashes
21,The Shadow of the Torturer,Gene Wolfe,1500,22920,3.8,262,1984,1980,1,"Fantasy,Science Fiction,Fiction","Nebula Award Nominee for Best Novel (1980), Locus Award Nominee for Best Fantasy Novel (1981), World Fantasy Award for Best Novel (1981), British Science Fiction Association Award for Best Novel (1981), John W. Campbell Memorial Award Nominee (1981)
Balrog Award Nominee for Best Novel (1981), Tähtifantasia Award Nominee (2013), Tähtivaeltaja Award (2013) ",Urth,https://www.goodreads.com/book/show/60211.The_Shadow_of_the_Torturer
22,The Hunger Games,Suzanne Collins,179557,6997477,4.32,284,2008,,1,"Young Adult,Fiction,Science Fiction > Dystopia","Locus Award Nominee for Best Young Adult Book (2009), Georgia Peach Book Award (2009), Buxtehuder Bulle (2009), Golden Duck Award for Young Adult (Hal Clement Award) (2009), Grand Prix de l'Imaginaire Nominee for Roman jeunesse étranger (2010)
Books I Loved Best Yearly (BILBY) Awards for Older Readers (2012), West Australian Young Readers' Book Award (WAYRBA) for Older Readers (2010), Red House Children's Book Award for Older Readers & Overall (2010), South Carolina Book Award for Junior and Young Adult Book (2011), Charlotte Award (2010), Colorado Blue Spruce Young Adult Book Award (2010), Teen Buckeye Book Award (2009), Pennsylvania Young Readers' Choice Award for Young Adults (2010), Rhode Island Teen Book Award (2010), Dorothy Canfield Fisher Children's Book Award (2010), Evergreen Teen Book Award (2011), Soaring Eagle Book Award (2009), Milwaukee County Teen Book Award Nominee (2010), Sakura Medal for Middle School Book (2010), Michigan Library Association Thumbs Up! Award (2009), Florida Teens Read (2009), Deutscher Jugendliteraturpreis for Preis der Jugendjury (2010), Iowa High School Book Award (2011), New Mexico Land of Enchantment Award for Young Adult (2011), Eliot Rosewater Indiana High School Book Award (2010), The Inky Awards for Silver Inky (2009), California Young Readers Medal for Young Adult (2011), Lincoln Award (2011), Kinderboekwinkelprijs (2010), Missouri Truman Readers Award (2011), CYBILS Award for Young Adult Fantasy & Science Fiction (2008), Literaturpreis der Jury der jungen Leser for Jugendbuch (2010), The Inky Awards Shortlist for Silver Inky (2009), Prix Et-lisez-moi (2011), Missouri Gateway Readers Award (2011), Oklahoma Sequoyah Award for High School and Intermediate (2011), Premio El Templo de las Mil Puertas for Mejor novela extranjera perteneciente a saga (2009), Rebecca Caudill Young Readers' Book Award (2011), LovelyBooks Leserpreis for Fantasy (2009), LovelyBooks Leserpreis for Bestes Cover/Umschlag (2009), Premi Protagonista Jove for Categoria 13-14 anys (2010) ","District 12, Panem,Capitol, Panem,Panem",https://www.goodreads.com/book/show/2767052-the-hunger-games
23,The Lord of the Rings,J.R.R. Tolkien,12448,607091,4.5,1216,2005,1955,1,"Classics,Science Fiction Fantasy,Fantasy > Epic Fantasy","Hugo Award Nominee for Best All-Time Series (1966), Prometheus Hall of Fame Award (2009), International Fantasy Award for Fiction (1957), Books I Loved Best Yearly (BILBY) Awards for Older Readers (2002), Prix du Meilleur Livre Étranger for Roman (1972)
Nynorsk litteraturpris (2006) ",Middle-earth,https://www.goodreads.com/book/show/33.The_Lord_of_the_Rings
24,The Scorpio Races,Maggie Stiefvater,13448,109432,4.06,409,2011,2011,0,"Fantasy,Young Adult,Romance","Mythopoeic Fantasy Award Nominee for Children's Literature (2012), Odyssey Award Nominee (2012), Los Angeles Times Book Prize Nominee for Young Adult Literature (2011), Michael L. Printz Award Nominee (2012), Milwaukee County Teen Book Award Nominee (2013)
The Inky Awards Nominee for Silver Inky (2012), Carnegie Medal Nominee (2013), Premio El Templo de las Mil Puertas for Mejor novela extranjera independiente (2013) ",Thisby,https://www.goodreads.com/book/show/10626594-the-scorpio-races
25,The Graveyard Book,Neil Gaiman,33717,480910,4.13,312,2008,,0,"Fantasy,Young Adult,Fiction","Hugo Award for Best Novel (2009), Newbery Medal (2009), Locus Award for Best Young Adult Novel (2009), World Fantasy Award Nominee for Best Novel (2009), Mythopoeic Fantasy Award Nominee for Children's Literature (2009)
Audie Award for Audiobook of the Year (2009), Dorothy Canfield Fisher Children's Book Award Nominee (2010), Michigan Library Association Thumbs Up! Award Nominee (2009), Indies Choice Book Award for Best Indie Young Adult Buzz Book (Fiction): (2009), Amelia Elizabeth Walden Award Nominee (2009), British Fantasy Award Nominee for Best Novel (2009), CYBILS Award for Middle Grade Fantasy & Science Fiction (2008), Carnegie Medal (2010), Elizabeth Burr / Worzalla Award (2009), Premio El Templo de las Mil Puertas for Mejor novela extranjera independiente (2009), Rebecca Caudill Young Readers' Book Award Nominee (2013) ","England,United Kingdom,Old Town",https://www.goodreads.com/book/show/2213661.The_Graveyard_Book
26,The White Dragon,Anne McCaffrey,899,45481,4.18,468,1986,1978,1,"Fantasy,Science Fiction,Fantasy > Dragons","Hugo Award Nominee for Best Novel (1979), Locus Award Nominee for Best SF Novel (1979), Ditmar Award for Best International Long Fiction (1979), Gandalf Award (1979), Balrog Award Nominee for Best Novel (1979)
The ESFS Award for Novel (1980), Margaret A. Edwards Award (1999) ",Pern,https://www.goodreads.com/book/show/127586.The_White_Dragon
27,A Dance with Dragons,George R.R. Martin,22797,592951,4.31,1125,2011,,1,"Fantasy,Fiction,Fantasy > Epic Fantasy","Hugo Award Nominee for Best Novel (2012), Locus Award for Best Fantasy Novel (2012), World Fantasy Award Nominee for Best Novel (2012), SFX Award for Best Novel (2012), British Fantasy Award Nominee for Best Novel (2012)
Goodreads Choice Award for Fantasy and Nominee for Favorite Book (2011) and Nominee for Best of the Best (2018) ",,https://www.goodreads.com/book/show/10664113-a-dance-with-dragons
28,The False Prince,Jennifer A. Nielsen,9811,88598,4.17,342,2012,,1,"Fantasy,Young Adult,Childrens > Middle Grade","Utah Book Award for Young Adult Literature (2014), Pennsylvania Young Readers' Choice Award Nominee for Grades 6-8 (2014), Rhode Island Teen Book Award Nominee (2014), Dorothy Canfield Fisher Children's Book Award Nominee (2014), California Young Readers Medal for Middle School/Junior High (2015)
Louisiana Young Readers' Choice for Grades 6-8 (2015), Goodreads Choice Award Nominee for Middle Grade & Children's (2012), Oklahoma Sequoyah Award for Intermediate (2015), Rebecca Caudill Young Readers' Book Award Nominee (2015) ",,https://www.goodreads.com/book/show/12432220-the-false-prince
29,Children of Blood and Bone,Tomi Adeyemi,26936,194721,4.08,544,2018,,1,"Fantasy,Young Adult,Fiction","Locus Award Nominee for First Novel (2019), William C. Morris YA Debut Award Nominee (2019), Audie Award for Audiobook of the Year (2019), Teen Buckeye Book Award (2019), Rhode Island Teen Book Award Nominee (2020)
British Fantasy Award Nominee for Best Newcomer (Sydney J. Bounds Award) (2019), Lincoln Award Nominee (2020), Andre Norton Award (2018), Kirkus Prize Nominee for Young Readers' Literature (2018), Goodreads Choice Award for Debut Author and Nominee for Young Adult Fantasy & Science Fiction (2018), Dragon Award for Best Young Adult / Middle Grade Novel (2018), Nommo Award Nominee for Best Novel (The Ilube Award) (2019), Lodestar Award (2019), BookNest Award Nominee for Best Traditionally Published Novel (2018) ",,https://www.goodreads.com/book/show/34728667-children-of-blood-and-bone
30,The Amber Spyglass,Philip Pullman,11570,330014,4.08,465,2003,2000,1,"Fantasy,Young Adult,Fiction","Booker Prize Nominee for Longlist (2001), Locus Award Nominee for Best Fantasy Novel (2001), Whitbread Award for Children's Book of the Year and Book of the Year (2001), British Book Award for Children's Book of the Year (2001), Audie Award for Children's Titles Ages 8-12 (2002)
West Australian Young Readers' Book Award (WAYRBA) for Older Readers (2002) ",,https://www.goodreads.com/book/show/18122.The_Amber_Spyglass
31,Harry Potter and the Deathly Hallows,J.K. Rowling,71112,3093400,4.61,759,2007,,1,"Fantasy,Young Adult,Fiction","Locus Award Nominee for Best Young Adult Novel (2008), Odyssey Award Nominee (2008), Audie Award (2008), Books I Loved Best Yearly (BILBY) Awards for Older Readers (2008), Teen Read Award Nominee for Best All-Time-Fave (2010)
Puddly Award for Fiction (2008), Andre Norton Award (2007), Carnegie Medal Nominee (2008) ","London, England,Hogwarts School of Witchcraft and Wizardry,Pagford",https://www.goodreads.com/book/show/136251.Harry_Potter_and_the_Deathly_Hallows
32,Harry Potter and the Prisoner of Azkaban,J.K. Rowling,62969,3195286,4.57,435,2004,1999,1,"Fantasy,Young Adult,Fiction","Bram Stoker Award for Best Work for Young Readers (1999), Hugo Award Nominee for Best Novel (2000), Locus Award for Best Fantasy Novel (2000), Whitbread Award for Children's Book of the Year (1999), Mythopoeic Fantasy Award for Children's Literature (2008)
Books I Loved Best Yearly (BILBY) Awards for Older Readers (2005), Colorado Blue Spruce Young Adult Book Award (2004), Maine Student Book Award (2001), Golden Archer Award for Intermediate (2001), Indian Paintbrush Book Award (2004), Soaring Eagle Book Award (2002), Hotze de Roosprijs (2001), Nestlé Smarties Book Prize for 9–11 years (1999) ","Hogwarts School of Witchcraft and Wizardry,London, England",https://www.goodreads.com/book/show/5.Harry_Potter_and_the_Prisoner_of_Azkaban
33,Skulduggery Pleasant,Derek Landy,4567,59450,4.13,392,2007,,1,"Fantasy,Young Adult,Mystery","Mythopoeic Fantasy Award Nominee for Children's Literature (2008), Odyssey Award Nominee (2008), Red House Children's Book Award for Older Readers & Overall (2008), Bolton Children's Book Award (2008), California Young Readers Medal Nominee for Middle School/Junior High (2011)
Carnegie Medal Nominee (2008) ",Ireland,https://www.goodreads.com/book/show/284440.Skulduggery_Pleasant
34,River of Stars,Guy Gavriel Kay,757,6694,4.14,639,2013,2013,1,"Fantasy,Historical > Historical Fiction,Fiction","Locus Award Nominee for Best Fantasy Novel (2014), Sunburst Award Nominee for Adult (2014), Prix Aurora Award Nominee for Best Novel (2014), Goodreads Choice Award Nominee for Fantasy (2013), Prix Elbakin.net for Meilleur roman fantasy traduit (2017)
Copper Cylinder Award for Adult (2014) ",,https://www.goodreads.com/book/show/15808474-river-of-stars
35,Peter and the Starcatchers,Dave Barry,4997,74233,4.03,452,2006,2004,1,"Fantasy,Young Adult,Fiction","Audie Award for Children's Titles Ages 8-12 (2005), Grand Canyon Reader Award for Intermediate Book (2006), Pennsylvania Young Readers' Choice Award for Grades 6-8 (2007), Dorothy Canfield Fisher Children's Book Award Nominee (2006), Sunshine State Young Readers Award for Grades 6-8 (2006)
Rebecca Caudill Young Readers' Book Award Nominee (2007) ",,https://www.goodreads.com/book/show/34262.Peter_and_the_Starcatchers
